Course,Skills,Interests,Industry,CareerComputer Science,"Programming, Programming languages, Java, Python, Software Development, Algorithms, C++, C#, JavaScript, Ruby, Data Structures, Object-Oriented Programming, Debugging, Testing, Version Control, Git, Github, Database Management, Software Development Life Cycle, Communication, Teamwork, Critical Thinking, Time Management, Continuous Learning
","Developing software, problem-solving, coding, Coding Challenges, Open Source Contributions, contributing, Technology Trends, trends, Software Architecture, User Experience, Design, Artificial Intelligence, Machine Learning, Data Visualization, Community Building, Gaming, Game Development, Cybersecurity, Web Development, Mobile Development, Robotics, softwares, software, creating software, SDLC, Software Development Life Cycle, Software development, Data Structures, Algorithms
","Technology, Software",Software EngineerComputer Science,"HTML, CSS, JavaScript, Responsive Design, Version Control, Git, Frontend Frameworks, React, Angular, Vue, Svelte, Backend Development, NodeJS, Python, Ruby, Ruby on Rails, Database Management, SQL, MongoDB, noSQL, API Integration, Web Security, Testing and Debugging, Problem-Solving Skills, Frontend, Backend, Fullstack","Coding, Programming, Websites, Web, WWW, Web Design, Technology, Problem Solving, Continuous Learning, Creativity, Collaboration, User Experience, UX, Open Source, Entrepreneurship","Technology, Web Design",Web DeveloperComputer Science,"SQL, Data Analysis Tools, Pandas, Numpy, Data Visualization, Python, R, Data Wrangling, Statistical Analysis, Machine Learning Techniques, Critical Thinking, Problem-Solving, Communication, Attention to Detail, Business Acumen, Data Mining, Data Warehousing, Database Management, Spreadsheet, Excel, Tables, Reporting and Dashboarding, Text Mining, Web Scraping, API Integration","Problem-Solving, Data Analysis, Statistics, Mathematics, Programming, Calculus, Algebra, Technology, Data Visualization, Business, Research, Continuous Learning, Logical Thinking, Attention to Detail, Curiosity, Storytelling with Data, Data-driven Decision Making, Working with Large Datasets, Pattern Recognition, Optimizing Processes, Exploring New Tools and Techniques, Understanding Business Metrics, Improving Efficiency, Uncovering Insights from Data, Discovering insights","Technology, Data Analysis",Data AnalystComputer Science,"Network Security, Cybersecurity Tools, Wireshark, Metasploit, Incident Response, risk assessment, incident response, threat analysis, network security, application security, security controls, vulnerability management, penetration testing, security auditing, security monitoring, data protection, regulatory compliance, problem-solving, critical thinking, attention to detail, communication skills, collaboration, continuous learning, hacking, securing data, security, ethical hacking, system security, encryption, decrryption, cryptography, troubleshooting","Cybersecurity, ethical hacking, information security, technology, computer networks, risk management, digital forensics, cryptography, penetration testing, malware analysis, cybercrime investigations, cybersecurity research, cybersecurity trends, information assurance, data privacy, cybersecurity certifications, cybersecurity conferences, cybersecurity blogs, cyberscurity forums, securing sytems, securing networks, troubleshooting, virus, hacks, hacking","Technology, Cybersecurity",Cybersecurity AnalystComputer Science,"Linux, Unix, Networking, Shell Scripting, Server Management, Security Management, Virtualization, Scripting, Programming, Problem-Solving, Documentation, Backuping, Recovery, Performance Monitoring, Project Management, Communication, Troubleshooting, Cloud Computing, Automation, Operating Systems, Windows, Linux, Database Management, Patch Management, User Management, Recovery Planning, Budgeting and Cost Management","Managing IT systems, troubleshooting, system optimization, Technology, Computers, Problem-Solving, Automation, Cybersecurity, Networking, Programming, Continuous Learning, Efficiency Optimization, System Architecture, Cloud Computing, Data Centers, Server Maintenance, Scripting, Virtualization, Open Source Technologies, Enterprise Applications, Project Management, Technical Documentation","Technology, IT",Systems AdministratorComputer Science,"Mobile Development, Mobile UI/UX Design, Cross-platform, Java, Kotlin, Android, iOs, Swift, Objective-C, User Interface Design, UI design, APIs, Databases, Mobile Architecture, Testing, Debugging, Version Control, Agile Methodologies, Problem-Solving, Collaboration, Continuous Learning, Flutter, App development, Native App Development","Technology, Mobile Devices, User Experience, Problem-Solving, Coding, App Design, App Development Process, Programming Languages, Software Architecture, User Interface Design, API Integration, Databases, Emerging Trends, Consumer Behavior, Entrepreneurship, Startups, App Marketplaces, Mobile Gaming, Productivity Apps, Social Media Apps, Playstore, Appstore, Cellphones, Smartphones, Mobile","Technology, Mobile",Mobile App DeveloperComputer Science,"Machine Learning Algorithms, TensorFlow, Scikit-learn, Deep Learning, Programming Skills, Python, R, Java, C++, Data Wrangling, Data Preprocessing, Statistical Analysis, Probability, Mathematics, Algorithms, Data Structures, Data Models, Data Visualization, Software Engineering, System Design, Cloud Computing, Big Data Tools, Communication, Collaboration, Critical Thinking, Problem-Solving, Continuous Learning, Curiosity","Artificial intelligence, data mining, pattern recognition, Data Science, Statistics, Mathematics, Algorithms, Programming, Problem-Solving, Automation, Predictive Modeling, Optimization, Computer Vision, Natural Language Processing, Deep Learning, Reinforcement Learning, Big Data, Cloud Computing, Data Visualization, Scientific Research, Technology Trends, AI, machine learning, cloud, cloud technology","Technology, AI",Machine Learning EngineerComputer Science,"Testing, Manual Testing, Automated testing, Tester, Bug Tracking Tools, Jira, Bugzilla, Bug Tracking, Bug tracker, Testing fundamentals, requirement analysis, test planning, test case design, test execution, defect management, test automation, API testing, cross-browser testing, performance testing, security testing, usability testing, agile testing, test management tools, programing, scripting, attention to detail, critical thinking, problem-solving, communication, documentation, teamwork, time management, continuous learning","software quality, attention to detail, problem-solving, Technology, software development life cycle, SDLC, quality assurance methodologies, quality assurance, QA, testing techniques, testing, automation tools, programming languages, puzzles, problems, problem-solving, attention to detail, user experience, product quality, continuous improvement, quality, improvement, technical documentation, customer satisfaction, satisfaction, collaboration, mentoring, learning new skills, being updated, updated, staying updated, industry trends, contributing to open source projects, attending tech events/meetups, reading tech blogs, reading tech articles, contributing, tech events, tech meetups","Technology, QA",Software Quality Assurance EngineerComputer Science,"Game Development Frameworks, Unity, Unreal Engine, 3D Modeling, AI in Games, Programming, Game Engines, Animation, Level Design, Scripting, Game Design, Storytelling, User Interface Design, Physics Simulation, Physics, AI, Artificial Intelligence, Audio Programming, Quality Assurance, Project Management, Collaboration, Problem-solving, Creativity, Attention to Detail, detailer, Creative Writing, logic","Game design, creating, gaming, Video Games, Storytelling, Animation, 3D Modeling, Programming, Technology, Visual Arts, Creative Writing, Problem-solving, Puzzle-solving, puzzle, logic, Fantasy/Science Fiction, Level Design, User Experience, Virtual Reality, Artificial Intelligence, Computer Graphics, Game Mechanics, Character Development, World-building, AI, Stories, Inspirations","Technology, Gaming",Game DeveloperComputer Science,"Cloud Computing, Terraform, CloudFormation, Cloud Computing Fundamentals, Cloud Architecture Design, Cloud Service Models, IaaS, PaaS, SaaS, Cloud Deployment Models, Cloud Deployment, Cloud Service Provider, AWS, Azure, GCP, Networking, Security, Automation,Scripting, Containerization, Docker, Kubernetes, DevOps, Cost Optimization, Monitoring and Logging, Business Analysis, Technical Requirements Analysis, Project Management, Communication, Presentation","Designing cloud solution, problem-solving, Cloud Computing, Emerging Technologies, Distributed Systems, Scalability, High Availability, Automation, DevOps, Containerization, Virtualization, Infrastructure as Code, Network Architecture, Security Best Practices, Cost Optimization, Solution Architecture, Technology Trends, Agile Methodologies, Continuous Integration/Continuous Deployment, CI/CD, Open Source Technologies, Technical Blogging, Techinical Writing, Public Speaking, Mentoring, Collaboration, Problem-Solving, cloud","Technology, Cloud Computing",Cloud Solutions ArchitectComputer Science,"User Interface Design, User Experience Research, Wireframing, Researching, User Analysis, Designing, User Empathy, Wireframing, Prototyping, Visual Design, Interaction Design, Usability Testing, Design Tools, Figma, Sketch, Adobe XD, Information Architecture, User Interface Design Principles, UI, UX, Typography, Color Theory, Grid Systems, Responsive Design, Accessibility Standards, Agile Methodologies, Communication Skills, Presentation Skills, Collaboration","Designing intuitive interfaces, user experience, UI, UX, user interface, Understanding User Behavior, Psychology of Human-Computer Interaction, Enhancing User Experiences, Design Thinking Methodologies, User Research Techniques, User Testing, User Feedback, Accessibility and Inclusive Design, Visual Design Principles, Color Theory, Typography, Iconography, Layout and Composition, Design Software, Figma, Sketch, Adobe XD, Prototyping Tools, Front-End Development, Design Patterns and Best Practices, Emerging Technologies, Design Systems, Style Guides, Data Visualization, Information Architecture, Interaction Design, Product Design Process,Design Critique, Design Feedback,Design Trends and Inspiration,Usability Heuristics, Design Thinking Workshops, Case Studies of Successful Designs,Design Communities, Design Meetups","Technology, Design",UI/UX DesignerComputer Science,"Database Management Systems, DBMS, MySQL, PostgreSQL, SQL, noSQL, Analysis, Data Modeling, Database Design, SQL Programming, Query Optimization, Data Warehousing, Database Administration, Database Security, Backup and Recovery, Backuping, Recovering, Performance Tuning, Database design, Database Security, Business Intelligence,Data Integration,Data Quality Management,Database Administration Tools,Database Scripting,Troubleshooting,Project Management,Communication Skills,Problem-Solving Skills,Attention to Detail,Continuous Learning","Data Analysis,Data Organization,Database Technologies,Database Architecture,Data Integrity,Data Security,Database Performance Optimization,Data Warehousing,Business Intelligence,Data Mining,Data Visualization,Data Quality Assurance,Data Modeling,Database Development,Database Administration Tools,Query Optimization,Backup and Recovery Strategies,Troubleshooting,Problem-Solving,Continuous Learning, Database admin","Technology, Database",Database AdministratorComputer Science,"Continuous Integration/Continuous Deployment, CI/CD, Configuration Management Tools, Docker, Ansible, Coding/Scripting,Linux/Unix,Automation Tools, Puppet, Configuration Management,Containerization, Docker, Kubernetes, Cloud Platforms, AWS, Azure, GCP, Infrastructure as Code, Terraform, CloudFormation, Monitoring, Prometheus, Grafana, Nagios, Logging and Log Management,Networking,Security, SSL/TLS, Firewall, IAM,Collaboration, Communication, Problem-solving, Adaptability","Automation, collaboration between development and operations teams, infrastructure as code, Automation,System Administration,Cloud Computing,Scripting,Programming,Containerization,Continuous Integration/Continuous Deployment,Infrastructure as Code,DevOps Culture,Agile Methodologies,Site Reliability Engineering,Monitoring,Logging,Networking,Security,Open Source Technologies,Learning New Tools and Technologies,Problem-solving,Collaboration,Process Improvement","Technology, DevOps",DevOps EngineerComputer Science,"Project Management, Agile Methodologies, Agile, Scrum, Scrum Methodologies, Budgeting, Planning, Leadership,Communication, Planning, Scheduling, Risk Management, Cost Management, Quality Management, Stakeholder Management, Team Management, Technical Expertise, Decision-Making, Problem-Solving, Conflict Resolution, Negotiation, Time Management, Adaptability, Strategic Thinking, Analytical Skills, Attention to Detail, Documentation","Leading teams, managing projects, problem-solving, Technology,Leadership,Management, Strategic Planning,Process Improvement,Business Analysis,Team Building,Project Methodologies,Risk Mitigation,Cost Control,Quality Assurance,Stakeholder Engagement,Organizational Behavior,Professional Development,Mentoring,Collaboration,Innovation,Continuous Learning,Industry Trends, managing, guiding, leading","Technology, Management",IT Project ManagerComputer Science,"Technical Writing, Documentation Tools, Markdown, LaTeX, Writing Skills, Research Skills, Subject Matter Expertise, Attention to Detail, Technical Proficiency, Communication Skills, Organizational Skills, Editing and Proofreading, Adaptability, Problem-Solving Skills, Time Management, Collaboration, Visual Communication Skills","Writing technical documentation, simplifying complex concepts, Technology, Writing, Reading, Learning, Explaining Complex Topics, Innovative Products, Science, Engineering, Computer Software/Hardware, Electronics, Technical Manuals/Documentation, Instructional Design, Editing, Research, Critical Thinking, Problem-Solving, Continuing Education, Industry Trends, Professional Development, writing, checking, technicality","Technology, Writing",Technical WriterComputer Science,"IT Strategy, Business Analysis, Information Systems Management, Technical knowledge, Problem-solving ability, Communication skills, Analytical thinking, Project management, Business acumen, Time management, Adaptability, Critical thinking, Attention to detail, Teamwork, Leadership, Presentation skills, Client management, Industry expertise, Research skills, Learning agility, Documentation skills, Troubleshooting, Vendor management","Consulting, problem-solving, client interaction, Technology trends,Problem-solving,Business strategy,Process improvement,Data analysis,Industry news and developments,Professional development,Project management methodologies,Change management,Innovation,Research,Mentoring,Public speaking,Writing/Blogging,Networking events,Continuing education,Thought leadership, consulting, guiding, thoughts, insights, perspective","Technology, Consulting",IT ConsultantComputer Science,"Sales, Software Knowledge, Communication skills, product knowledge, prospecting skills, negotiation skills, problem-solving skills, time management skills, customer relationship management, technological proficiency, sales strategy development, data analysis, sales forecasting, presentation skills, market research, industry knowledge, perseverance, adaptability, multitasking","Sales, persuasion, customer relations, understanding customer needs, Technology, software solutions, business trends, entrepreneurship, networking events, industry conferences, continuous learning, reading business publications, sales methodologies, personal development, public speaking, data analysis, market research, customer success stories, competitive analysis, business strategy, software sales","Technology, Sales",Software Sales RepresentativeComputer Science,"
Information Security, Risk Management, Incident Response, Risk Assessment, Vulnerability Analysis, Incident Response, Network Security Monitoring, Security Policies Development, Security Tools Implementation, Cybersecurity Laws and Regulations Knowledge, Programming Skills, Problem-solving Skills, Analytical Thinking, Communication Skills, Continuous Learning","Cybersecurity, Ethical Hacking, Penetration Testing, Network Security, Cryptography, Digital Forensics, Threat Intelligence, Risk Management, Data Privacy, Information Assurance, Cybercrime Investigations, Emerging Technologies, Malware Analysis, Security Research, Continuous Learning","Technology, Security",Information Security AnalystComputer Science,"Hardware installation, maintenance, Software installation, troubleshooting, Network configuration, Data backup, recovery, Security management, Customer service, technical support, Problem-solving, critical thinking, Multitasking, time management, Documentation, record-keeping, Continuous learning, adaptability, PC building, building, fixing, repairing, computer diagnosing, Tinkering with electronics, Building and repairing computers","Diagnosing and repairing computer systems, Technology trends, Computer hardware, Software applications, Cybersecurity, Networking, Troubleshooting challenges, Problem-solving, Continuous learning, Staying up-to-date with industry developments, Tinkering with electronics, Building and repairing computers, Automating processes, Efficient systems design, Technical writing, Customer support","Technology, IT Support",Computer Systems TechnicianComputer Science,"Blockchain Development, Smart Contracts, Solidity, JavaScript, Python, C++, Rust, Go, Cryptography knowledge, Distributed systems understanding, Smart contract development, Consensus mechanisms comprehension, Peer-to-peer networking knowledge, Data structures and algorithms expertise, Database management, LevelDB, RocksDB, Blockchain architecture understanding, Security best practices, Version control, GIT, Testing and debugging skills, Problem-solving and analytical thinking","Cryptocurrency, blockchain technology, decentralized applications, DApps, Decentralization, Cryptocurrency, Distributed ledger technology, Cryptography, Peer-to-peer systems, Open-source software, Cybersecurity, Financial technology, FinTech, Disruptive technologies, Privacy and anonymity, Consensus algorithms, Smart contracts, Tokenization, Dapp, Decentralized App development, supply chain, governance, blockchain, web3, new trends, bitcoin, btc","Technology, Blockchain",Blockchain DeveloperInformation Technology,"Networking (LAN/WAN), Cisco Systems, TCP/IP, Routing and Switching, planning,installation,configuration,administration,maintenance,troubleshooting,documentation,security,virtualization,scripting,automation,monitoring,budgeting,vendor management,communication,problem-solving,decision-making,adaptability,attention to detail, time management 
","Managing network infrastructure, managing networks, troubleshooting, computer networking, cyber security, new technologies, problem solving, continuous learning, automation, virtualization, cloud computing, data centers, infrastructure design, performance optimization, scripting, coding, system administration, project management 
","Technology, Networking",Network AdministratorInformation Technology,"Troubleshooting, Help Desk Support, Customer Service, Technical Skills, Hardware skills, PC building,Hardware Knowledge,Software Knowledge,Network Configuration,Cybersecurity Fundamentals,Operating Systems,Database Management,Scripting, Programming,Documentation,Communication Skills,Problem-Solving Skills,Multitasking,Customer Service,Patience,Attention to Detail","Assisting users with technical issues, problem-solving, assisting, guiding, Technology,Computing,Electronics,Helping Others,Continuous Learning,Gadgets,Cybersecurity,Programming,Video Games,Tinkering, PC building, Building Computers,Networking,Staying Up-to-Date with Tech Trends, Tech trends, Databases,Operating Systems,Tech Blogs, Tech Forums,Logical Thinking,Troubleshooting, supporting","Technology, IT Support",IT Support SpecialistInformation Technology,"System Analysis, Requirement Gathering, UML Modeling, analytical thinking, problem-solving, requirements gathering, process modeling, data analysis, documentation, communication, project management, stakeholder management, technical knowledge, knowledge in programming, knowledge in databases, networking, business acumen, attention to detail, time management, adaptability, critical thinking.","Analyzing business requirements, designing system solutions, technology trends, process improvement, data analysis, problem-solving, business operations, system architecture, programming, database management, network administration, project management, requirements engineering, user experience, information security, change management, business analysis","Technology, Business",Systems AnalystInformation Technology,"Database Management Systems, DBMS, MySQL, PostgreSQL, SQL, noSQL, Analysis, Data Modeling, Database Design, SQL Programming, Query Optimization, Data Warehousing, Database Administration, Database Security, Backup and Recovery, Backuping, Recovering, Performance Tuning, Database design, Database Security, Business Intelligence,Data Integration,Data Quality Management,Database Administration Tools,Database Scripting,Troubleshooting,Project Management,Communication Skills,Problem-Solving Skills,Attention to Detail,Continuous Learning","Data Analysis,Data Organization,Database Technologies,Database Architecture,Data Integrity,Data Security,Database Performance Optimization,Data Warehousing,Business Intelligence,Data Mining,Data Visualization,Data Quality Assurance,Data Modeling,Database Development,Database Administration Tools,Query Optimization,Backup and Recovery Strategies,Troubleshooting,Problem-Solving,Continuous Learning, Database admin","Technology, Database",Database AdministratorInformation Technology,"Project Management, Agile Methodologies, Agile, Scrum, Scrum Methodologies, Budgeting, Planning, Leadership,Communication, Planning, Scheduling, Risk Management, Cost Management, Quality Management, Stakeholder Management, Team Management, Technical Expertise, Decision-Making, Problem-Solving, Conflict Resolution, Negotiation, Time Management, Adaptability, Strategic Thinking, Analytical Skills, Attention to Detail, Documentation","Leading teams, managing projects, problem-solving, Technology,Leadership,Management, Strategic Planning,Process Improvement,Business Analysis,Team Building,Project Methodologies,Risk Mitigation,Cost Control,Quality Assurance,Stakeholder Engagement,Organizational Behavior,Professional Development,Mentoring,Collaboration,Innovation,Continuous Learning,Industry Trends, managing, guiding, leading","Technology, Management",IT Project ManagerInformation Technology,"HTML, CSS, JavaScript, Responsive Design, Version Control, Git, Frontend Frameworks, React, Angular, Vue, Svelte, Backend Development, NodeJS, Python, Ruby, Ruby on Rails, Database Management, SQL, MongoDB, noSQL, API Integration, Web Security, Testing and Debugging, Problem-Solving Skills, Frontend, Backend, Fullstack","Coding, Programming, Websites, Web, WWW, Web Design, Technology, Problem Solving, Continuous Learning, Creativity, Collaboration, User Experience, UX, Open Source, Entrepreneurship","Technology, Web Design",Web DeveloperInformation Technology,"Network Security, Cybersecurity Tools, Wireshark, Metasploit, Incident Response, risk assessment, incident response, threat analysis, network security, application security, security controls, vulnerability management, penetration testing, security auditing, security monitoring, data protection, regulatory compliance, problem-solving, critical thinking, attention to detail, communication skills, collaboration, continuous learning, hacking, securing data, security, ethical hacking, system security, encryption, decrryption, cryptography, troubleshooting","Cybersecurity, ethical hacking, information security, technology, computer networks, risk management, digital forensics, cryptography, penetration testing, malware analysis, cybercrime investigations, cybersecurity research, cybersecurity trends, information assurance, data privacy, cybersecurity certifications, cybersecurity conferences, cybersecurity blogs, cyberscurity forums, securing sytems, securing networks, troubleshooting, virus, hacks, hacking","Technology, Cybersecurity",Cybersecurity AnalystInformation Technology,"Testing, Manual Testing, Automated testing, Tester, Bug Tracking Tools, Jira, Bugzilla, Bug Tracking, Bug tracker, Testing fundamentals, requirement analysis, test planning, test case design, test execution, defect management, test automation, API testing, cross-browser testing, performance testing, security testing, usability testing, agile testing, test management tools, programing, scripting, attention to detail, critical thinking, problem-solving, communication, documentation, teamwork, time management, continuous learning","software quality, attention to detail, problem-solving, Technology, software development life cycle, SDLC, quality assurance methodologies, quality assurance, QA, testing techniques, testing, automation tools, programming languages, puzzles, problems, problem-solving, attention to detail, user experience, product quality, continuous improvement, quality, improvement, technical documentation, customer satisfaction, satisfaction, collaboration, mentoring, learning new skills, being updated, updated, staying updated, industry trends, contributing to open source projects, attending tech events/meetups, reading tech blogs, reading tech articles, contributing, tech events, tech meetups","Technology, QA",Software Quality Assurance Engineer