Course,Skills,Interests,Industry,CareerNurse,"Neonatal Care, Infant Health, Critical thinking, patient monitoring, meticulous documentation, compassion, emotional resilience, attention to detail, teamwork, communication skills, problem-solving, technical proficiency, knowledge of neonatal conditions and treatments, ability to work under pressure, time management, adaptability, continuing education","Providing specialized care for newborn infants, Caring for newborns, promoting infant health, interest in neonatal medicine, passion for nurturing vulnerable patients, fascination with child development, desire to work in a high-intensity environment, interest in specialized nursing, enthusiasm for lifelong learning, commitment to family-centered care, interest in cutting-edge medical technology, newborn, babies, premature, prematurity","Neonatology, Pediatrics",Neonatal NurseNurse,"Critical Care Nursing, Advanced Life Support, Critical thinking, problem-solving, attention to detail, communication, teamwork, emotional intelligence, stress management, knowledge of advanced life support techniques, proficiency in using medical equipment, understanding of pharmacology, ability to prioritize tasks, adaptability, quick decision-making, physical stamina, empathy, patient advocacy, ethical reasoning, continuous learning","Caring for critically ill patients, life-saving interventions, Patient care, healthcare, medicine, science, technology, critical care, emergencies, adrenaline-fueled environments, problem-solving, multitasking, teamwork, continuous learning, helping others, making a difference, high-stakes situations, physiology, anatomy, pharmacology, medical equipment, evidence-based practice","Critical Care, Acute Care",Intensive Care Unit (ICU) NurseNurse,"Palliative Care, End-of-Life Care",Providing comfort and support to terminally ill patients,"Hospice Care, Palliative Care",Hospice NurseNurse,"Wound Management, Dressing Changes",Treating and managing various types of wounds,"Wound Care, Skilled Nursing",Wound Care NurseNurse,"Dialysis Procedures, Nephrology, patient care, critical thinking, attention to detail, communication skills, empathy, technical skills, problem-solving, time management, physical stamina, knowledge of dialysis equipment, understanding of renal physiology, ability to work in a team, documentation skills, infection control protocols, emergency response","Providing dialysis treatment to patients with kidney failure, patient care, healthcare, science, technology, helping others, making a difference, medical equipment, renal health, physiology, lifelong learning, working in a team environment, attention to detail, problem-solving challenges","Nephrology, Renal Care",Dialysis NurseNurse,"Intravenous Therapy, Medication Administration",Administering medications and fluids via IV,"Infusion Therapy, Home Health",Infusion NurseNurse,"Patient Advocacy, Care Coordination",Guiding patients through complex healthcare systems,"Patient Navigation, Care Coordination",Nurse NavigatorNurse,"Remote Patient Monitoring, Telemedicine, Communication Skills, Active Listening, Empathy, Critical Thinking, Problem-Solving, Decision-Making, Time Management, Technological Proficiency, Documentation Skills, Knowledge of Telehealth Protocols, Patient Education, Cultural Competency, Collaboration, Adaptability, Stress Management","Providing virtual healthcare services, teleconsultations, Patient Care, Healthcare Technology, Telemedicine, Remote Patient Monitoring, Virtual Healthcare Delivery, Communication Technologies, Patient Education, Preventive Care, Chronic Disease Management, Improving Healthcare Access, Innovation in Healthcare, Patient Advocacy, Continuing Education, Interdisciplinary Collaboration, Work-Life Balance","Telehealth, Virtual Care, Technology",Telehealth NurseNurse,"Workplace Safety, Employee Health",Promoting health and wellness in the workplace,"Occupational Health, Employee Wellness",Occupational Health NurseNurse,"Legal Research, Medical Record Review",Assisting with legal cases involving healthcare issues,"Legal Services, Healthcare Consulting",Legal Nurse ConsultantNurse,"Genetic Counseling, Genetic Testing",Providing genetic education and counseling,"Genetics, Genetic Counseling",Genetics NurseNurse,"Infection Control, Epidemiology",Managing and preventing the spread of infectious diseases,"Infectious Disease Control, Public Health",Infectious Disease NurseNurse,"Medical Billing, Health Insurance",Reviewing healthcare claims for accuracy and compliance,"Healthcare Administration, Insurance",Nurse AuditorNurse,"Pain Assessment, Pain Relief Techniques",Managing and alleviating pain in patients,"Pain Management, Palliative Care",Pain Management NurseNurse,"Forensic Science, Evidence Collection",Collecting evidence related to crimes or accidents,"Forensic Nursing, Law Enforcement",Forensic NurseNurse,"Diabetes Management, Patient Education",Educating patients on diabetes management,"Diabetes Care, Patient Education",Diabetes Nurse EducatorNurse,"Clinical Trials, Research Methodology","Coordinating research studies, collecting and analyzing data","Nursing Research, Clinical Trials",Nurse Research CoordinatorNurse,"Infection Prevention, Sterilization",Preventing and controlling the spread of infections,"Infection Control, Public Health",Infection Control NurseNurse,"Business Development, Healthcare Innovation",Starting and managing nursing-related businesses,"Healthcare Entrepreneurship, Startups",Nurse EntrepreneurNurse,"Pain Assessment, Interventional Procedures",Providing advanced pain relief treatments,"Pain Management, Anesthesiology",Pain Management SpecialistNurse,"Symptom Management, End-of-Life Care",Providing comfort and support to patients with serious illnesses,"Palliative Care, Hospice Care",Palliative Care NurseNurse,"Patient Advocacy, Healthcare Policy",Advocating for patients' rights and needs,"Patient Advocacy, Healthcare Advocacy",Nurse AdvocateNurse,"Health Information Systems, Data Analysis",Implementing and optimizing healthcare technology systems,"Nursing Informatics, Health IT",Nursing Informatics SpecialistNurse,"Organ Procurement, Patient Coordination",Coordinating organ transplant procedures,"Transplantation, Organ Donation",Transplant CoordinatorNurse,"Patient Advocacy, Healthcare Policy",Advocating for patients' rights and needs,"Patient Advocacy, Healthcare Advocacy",Nurse AdvocateMechanical Engineering,"Mechanical Design, CAD, Manufacturing Processes, Thermal Analysis","Designing mechanical systems, problem-solving","Engineering, Manufacturing",Mechanical EngineerMechanical Engineering,"Process Optimization, Lean Manufacturing, Six Sigma","Improving manufacturing processes, optimizing production efficiency","Engineering, Manufacturing",Manufacturing EngineerMechanical Engineering,"Product Design, Prototyping, 3D Modeling","Designing and developing new products, bringing concepts to reality","Engineering, Product Design",Design EngineerMechanical Engineering,"HVAC Systems Design, Energy Efficiency, Building Automation","Designing heating, ventilation, and air conditioning systems","Engineering, HVAC",HVAC EngineerMechanical Engineering,"Thermal Analysis, Heat Transfer, Fluid Dynamics","Analyzing thermal systems, optimizing energy usage","Engineering, Energy",Thermal EngineerMechanical Engineering,"Aerodynamics, Aircraft Design, Aerospace Systems",Designing and testing aircraft and spacecraft,Aerospace Engineering,Aerospace EngineerMechanical Engineering,"Automotive Design, Vehicle Dynamics, Engine Performance","Designing vehicles, improving performance and safety",Automotive Engineering,Automotive EngineerMechanical Engineering,"Robotic Systems, Control Systems, Mechatronics",Designing and programming robotic systems for various applications,"Engineering, Robotics",Robotics EngineerMechanical Engineering,"Mechatronics, Control Systems, Embedded Systems","Designing and integrating mechanical, electrical, and computer systems","Engineering, Mechatronics",Mechatronics EngineerMechanical Engineering,"Renewable Energy Systems, Energy Efficiency, Energy Management","Designing and optimizing energy systems, reducing carbon footprint","Engineering, Energy",Energy EngineerMechanical Engineering,"Nuclear Reactor Design, Radiation Protection, Nuclear Safety","Designing nuclear power plants, ensuring safety and compliance",Nuclear Engineering,Nuclear EngineerMechanical Engineering,"Ship Design, Naval Architecture, Offshore Structures","Designing ships, marine systems, and offshore platforms",Marine Engineering,Marine EngineerMechanical Engineering,"Materials Science, Material Testing, Failure Analysis","Researching and developing new materials, improving material properties",Materials Engineering,Materials EngineerMechanical Engineering,"Biomechanics, Medical Device Design, Prosthetics","Designing medical devices, analyzing human movement",Biomedical Engineering,Biomechanical EngineerMechanical Engineering,"Hydraulic Systems, Pneumatics, Fluid Dynamics",Designing and optimizing hydraulic and pneumatic systems,"Engineering, Fluid Power",Fluid Power EngineerMechanical Engineering,"Process Design, Chemical Engineering, Process Optimization","Designing and optimizing industrial processes, improving efficiency","Engineering, Process",Process EngineerMechanical Engineering,"Acoustic Design, Noise Control, Vibration Analysis","Designing soundproofing systems, reducing noise pollution","Engineering, Acoustics",Acoustic EngineerMechanical Engineering,"Pipeline Design, Pipeline Integrity, Pipeline Inspection","Designing and managing pipelines, ensuring integrity and safety","Engineering, Pipeline",Pipeline EngineerMechanical Engineering,"Cryogenic Systems, Cryogenics Technology, Superconductivity",Designing and maintaining cryogenic systems for various applications,"Engineering, Cryogenics",Cryogenic EngineerMechanical Engineering,"HVAC System Installation, Maintenance, Troubleshooting","Installing and servicing heating, ventilation, and air conditioning systems",HVAC Services,HVAC TechnicianMechanical Engineering,"Tool Design, CNC Programming, Machining Processes",Designing and optimizing manufacturing tools and fixtures,"Manufacturing, Engineering",Tooling EngineerMechanical Engineering,"Railway Systems, Rail Transportation, Rail Safety","Designing railway infrastructure, optimizing rail systems",Railway Engineering,Railway EngineerMechanical Engineering,"Test Planning, Test Automation, Data Analysis","Developing and executing test plans, ensuring product quality","Engineering, Testing",Test EngineerMechanical Engineering,"CAD Software, Drafting, Blueprint Reading","Creating technical drawings, assisting engineers in the design process","Engineering, Drafting",CAD TechnicianMechanical Engineering,"Energy Modeling, Building Energy Efficiency, Energy Audits","Analyzing energy usage, identifying areas for improvement","Energy Efficiency, Consulting",Energy AnalystMechanical Engineering,"Fire Safety Systems, Fire Suppression Systems, Fire Risk Assessment",Designing and evaluating fire protection systems for buildings,Fire Protection Engineering,Fire Protection EngineerMechanical Engineering,"Aircraft Maintenance, Avionics Systems, Aircraft Performance",Ensuring aircraft safety and reliability,Aviation Engineering,Aviation EngineerMechanical Engineering,"Structural Design, Building Codes, Finite Element Analysis","Designing and analyzing structural components, ensuring safety","Engineering, Structural",Structural EngineerMechanical Engineering,"Renewable Energy Technologies, Energy Analysis","Designing renewable energy systems, optimizing energy efficiency","Renewable Energy, Sustainability",Renewable Energy EngineerMechanical Engineering,"HVAC Systems Design, Thermal Analysis","Designing heating, ventilation, and air conditioning systems","HVAC, Building Services",HVAC Design EngineerMechanical Engineering,"Automotive Engineering, Vehicle Dynamics",Designing and optimizing automotive systems,"Automotive, Transportation",Automotive Design EngineerMechanical Engineering,"Aerospace Engineering, Flight Dynamics",Designing and analyzing aerospace systems,"Aerospace, Aviation",Aerospace Systems EngineerMechanical Engineering,"Marine Engineering, Ship Design",Designing and analyzing marine systems,"Maritime, Shipbuilding",Marine Systems EngineerMechanical Engineering,"Biomechanics, Medical Device Design","Designing medical devices, biomechanical analysis","Biomedical Engineering, Healthcare",Biomedical EngineerMechanical Engineering,"Energy Auditing, Retrofitting",Improving energy efficiency in buildings and processes,"Energy Efficiency, Sustainability",Energy Efficiency EngineerMechanical Engineering,"Nuclear Engineering, Reactor Design",Designing and analyzing nuclear reactors,"Nuclear Power, Energy",Nuclear Reactor EngineerMechanical Engineering,"Fluid Mechanics, Computational Fluid Dynamics","Analyzing fluid flow phenomena, designing fluid systems","Fluid Dynamics, Aerospace",Fluid Dynamics EngineerMechanical Engineering,"Renewable Energy Technologies, Data Analysis","Analyzing renewable energy systems, assessing energy efficiency","Renewable Energy, Sustainability",Renewable Energy AnalystMechanical Engineering,"HVAC Controls, Building Automation",Designing and implementing HVAC control systems,"HVAC, Building Automation",HVAC Controls EngineerMechanical Engineering,"Manufacturing Processes, Process Optimization","Optimizing manufacturing processes, improving efficiency","Manufacturing, Industrial Engineering",Manufacturing Process EngineerMechanical Engineering,"CAD/CAM Software, Computer-Aided Design",Designing and programming computer-aided manufacturing systems,"CAD/CAM, Manufacturing",CAD/CAM EngineerMechanical Engineering,"Railway Engineering, Track Design",Designing and analyzing railway systems,"Railway, Transportation",Railway Systems EngineerMechanical Engineering,"Materials Engineering, Material Testing",Developing and testing materials for various applications,"Materials Science, Manufacturing",Materials Science EngineerMechanical Engineering,"Structural Analysis, Vibration Control",Analyzing and mitigating structural vibrations,"Structural Engineering, Aerospace",Structural Dynamics EngineerMechanical Engineering,"HVAC Systems Installation, Project Management","Managing HVAC installation projects, ensuring quality and efficiency","HVAC, Construction",HVAC Project EngineerMechanical Engineering,"Pipeline Engineering, Corrosion Control",Ensuring the integrity and safety of pipelines,"Pipeline Engineering, Oil & Gas",Pipeline Integrity EngineerMechanical Engineering,"Cryogenic Engineering, Thermal Insulation",Designing and maintaining cryogenic systems,"Cryogenics, Aerospace",Cryogenic Systems EngineerMechanical Engineering,"HVAC Systems Sales, Client Relationship Management","Selling HVAC systems and services, client consultation","HVAC, Sales",HVAC Sales EngineerMechanical Engineering,"Project Management, Renewable Energy Development",Overseeing renewable energy projects from conception to completion,"Project Management, Renewable Energy",Renewable Energy Project ManagerMechanical Engineering,"HVAC Systems Commissioning, Quality Assurance",Ensuring proper installation and functionality of HVAC systems,"HVAC, Quality Assurance",HVAC Commissioning EngineerMechanical Engineering,"Vehicle Safety Systems, Crash Testing",Designing and testing safety features for automotive vehicles,"Automotive Safety, Engineering",Automotive Safety EngineerMechanical Engineering,"Aerospace Propulsion Systems, Jet Engines",Designing and analyzing propulsion systems for aircraft,"Aerospace, Propulsion Systems",Aerospace Propulsion EngineerMechanical Engineering,"Quality Control, Six Sigma Methodology","Implementing quality control measures, ensuring product quality","Manufacturing, Quality Assurance",Manufacturing Quality EngineerElectrical Engineering,"Circuit Design, Power Systems, Electronics","Designing electrical systems, solving technical problems","Engineering, Electrical",Electrical EngineerElectrical Engineering,"Power Distribution, Energy Management, Renewable Energy","Designing and optimizing power systems, improving energy efficiency","Engineering, Power Systems",Power Systems EngineerElectrical Engineering,"Control Theory, PLC Programming, PID Control",Designing and implementing control systems for various applications,"Engineering, Automation",Control Systems EngineerElectrical Engineering,"Analog Circuit Design, PCB Layout, Embedded Systems","Designing electronic circuits, developing electronic devices","Engineering, Electronics",Electronics EngineerElectrical Engineering,"Solar Energy Systems, Wind Energy Systems, Energy Storage","Designing and implementing renewable energy systems, sustainability","Engineering, Renewable Energy",Renewable Energy EngineerElectrical Engineering,"Power Electronics, Converter Design, Motor Drives","Designing power electronic converters, improving power efficiency","Engineering, Power Electronics",Power Electronics EngineerElectrical Engineering,"RF Circuit Design, Antenna Design, Wireless Communication","Designing and optimizing radio frequency systems, developing wireless technologies","Engineering, RF Communication",RF EngineerElectrical Engineering,"Industrial Automation, PLC Programming, SCADA Systems",Designing and implementing automated systems for manufacturing processes,"Engineering, Automation",Automation EngineerElectrical Engineering,"Instrumentation Design, Sensor Calibration, Data Acquisition","Designing and calibrating instruments, monitoring and control","Engineering, Instrumentation",Instrumentation EngineerElectrical Engineering,"Telecommunications Systems, Network Design, Fiber Optic Communication","Designing and optimizing telecommunications systems, improving network performance","Engineering, Telecommunications",Telecommunications EngineerElectrical Engineering,"Embedded Software Development, Microcontroller Programming","Developing embedded systems, programming microcontrollers","Engineering, Embedded Systems",Embedded Systems EngineerElectrical Engineering,"Electrical CAD, Building Systems Design, Lighting Design","Designing electrical systems for buildings, ensuring compliance with regulations","Engineering, Electrical Design",Electrical Design EngineerElectrical Engineering,"Test Automation, Test Procedures, Test Equipment Operation","Developing and executing test plans, ensuring product quality","Engineering, Testing",Test EngineerElectrical Engineering,"Systems Engineering, Requirement Analysis, System Integration","Designing and integrating complex systems, ensuring interoperability","Engineering, Systems",Systems EngineerElectrical Engineering,"Power Generation, Transmission Systems, Power Grid Stability","Designing and managing power generation, transmission, and distribution systems","Engineering, Power",Power EngineerElectrical Engineering,"FPGA Design, Verilog, VHDL, FPGA Prototyping",Designing and programming Field-Programmable Gate Arrays (FPGAs),"Engineering, FPGA",FPGA EngineerElectrical Engineering,"Electric Vehicle Design, Battery Management, EV Charging Infrastructure","Designing electric vehicle systems, developing battery technologies","Engineering, Electric Vehicles",Electric Vehicle EngineerElectrical Engineering,"Analog Circuit Design, Digital Circuit Design, PCB Layout","Designing and testing electronic circuits, optimizing circuit performance","Engineering, Circuit Design",Circuit Design EngineerElectrical Engineering,"Power Quality Analysis, Harmonic Analysis, Surge Protection","Analyzing and improving power quality, mitigating electrical disturbances","Engineering, Power Quality",Power Quality EngineerElectrical Engineering,"Power Systems Analysis, Grid Integration, Renewable Energy Integration","Analyzing and optimizing electric power systems, integrating renewable energy","Engineering, Electric Power",Electric Power Systems EngineerElectrical Engineering,"Broadcast Systems Engineering, RF Transmission Systems, Satellite Technology","Designing and maintaining broadcast systems, optimizing transmission quality","Engineering, Broadcasting",Broadcast EngineerElectrical Engineering,"Lighting Design, Illumination Analysis, Lighting Controls",Designing and optimizing lighting systems for various applications,"Engineering, Lighting",Lighting EngineerElectrical Engineering,"Hardware Design, PCB Design, Embedded Systems","Designing electronic hardware, developing PCB layouts","Engineering, Hardware",Hardware EngineerElectrical Engineering,"Microelectronics Fabrication, Semiconductor Devices, Cleanroom Procedures",Designing and manufacturing microelectronic devices,"Engineering, Microelectronics",Microelectronics EngineerElectrical Engineering,"Machine Learning, Data Analysis, Python Programming",Applying machine learning algorithms to engineering problems,"Engineering, Machine Learning",Machine Learning EngineerElectrical Engineering,"Renewable Energy Technologies, Data Analysis","Analyzing renewable energy systems, assessing energy efficiency","Renewable Energy, Sustainability",Renewable Energy AnalystElectrical Engineering,"Power Systems Analysis, Simulation","Analyzing power system performance, optimizing grid operations","Power Systems, Energy",Electric Power Systems AnalystElectrical Engineering,"Power Plant Operations, Maintenance",Operating and maintaining power generation facilities,"Energy, Power Generation",Power Plant EngineerElectrical Engineering,"Electrical Safety Standards, Risk Assessment","Ensuring electrical safety compliance, conducting risk assessments","Safety Engineering, Compliance",Electrical Safety EngineerElectrical Engineering,"Energy Storage Technologies, Battery Management",Designing and implementing energy storage systems,"Energy Storage, Renewable Energy",Energy Storage EngineerElectrical Engineering,"Grid Integration, Distributed Energy Resources",Integrating renewable energy sources into the grid,"Power Systems, Renewable Energy",Grid Integration EngineerElectrical Engineering,"Lighting Design, Illumination Engineering",Designing lighting systems for architectural and industrial applications,"Lighting Design, Architecture",Lighting Design EngineerElectrical Engineering,"Power Distribution Systems, Substation Design",Designing and managing electrical distribution systems,"Power Distribution, Utilities",Power Distribution EngineerElectrical Engineering,"EV Charging Systems, Infrastructure Planning",Designing and implementing electric vehicle charging stations,"Electric Vehicles, Transportation",Electric Vehicle Charging Infrastructure EngineerElectrical Engineering,"Sustainable Design, Green Building",Designing environmentally friendly infrastructure projects,"Sustainability, Construction",Sustainable Infrastructure EngineerElectrical Engineering,"Automation Systems, PLC Programming",Designing and implementing automated control systems,"Automation, Manufacturing",Electrical Automation EngineerElectrical Engineering,"High Voltage Systems, Insulation Coordination",Designing and maintaining high voltage electrical systems,"High Voltage Systems, Utilities",High Voltage EngineerElectrical Engineering,"Grid Modernization Technologies, Smart Grid",Implementing technologies for modernizing electrical grids,"Grid Modernization, Energy",Grid Modernization EngineerElectrical Engineering,"Lightning Protection Systems, Risk Assessment",Designing and implementing lightning protection systems,"Lightning Protection, Safety",Lightning Protection EngineerElectrical Engineering,"Project Management, Renewable Energy Development",Overseeing renewable energy projects from conception to completion,"Project Management, Renewable Energy",Renewable Energy Project ManagerElectrical Engineering,"Power Electronics, Circuit Design",Designing power electronic circuits and devices,"Power Electronics, Electrical Design",Power Electronics Design EngineerElectrical Engineering,"Energy Efficiency, Renewable Energy Policies",Advising clients on sustainable energy solutions,"Sustainability Consulting, Renewable Energy",Sustainable Energy ConsultantElectrical Engineering,"Electrical Code Compliance, Standards Development",Ensuring compliance with electrical codes and standards,"Standards Development, Compliance",Electrical Standards EngineerElectrical Engineering,"Smart Grid Technologies, Communication Protocols",Developing and implementing smart grid solutions,"Smart Grid, Energy",Smart Grid EngineerElectrical Engineering,"Reliability Analysis, Failure Analysis",Assessing and improving system reliability,"Reliability Engineering, Maintenance",Reliability EngineerElectrical Engineering,"Electric Motor Design, Rotating Machines",Designing efficient electric motors for various applications,"Electric Motors, Manufacturing",Electric Motor Design EngineerElectrical Engineering,"Energy Auditing, Retrofitting","Identifying energy-saving opportunities, implementing efficiency measures","Energy Efficiency, Sustainability",Energy Efficiency EngineerElectrical Engineering,"Industrial Control Systems, SCADA",Designing and implementing automation solutions for industrial processes,"Industrial Automation, Manufacturing",Industrial Automation EngineerElectrical Engineering,"HVDC Transmission Systems, Converter Technology",Designing and implementing high voltage direct current transmission systems,"HVDC Technology, Power Systems",HVDC EngineerElectrical Engineering,"Grid Reliability, Power Quality",Ensuring reliability and stability of electric power grids,"Power Systems, Reliability",Electric Grid Reliability Engineer